{
  "$schema": "https://json-schema.org/draft/2020-12/schema",
  "$id": "https://patchpilot.dev/schemas/mapping-pattern.json",
  "title": "PatchPilot Compliance Mapping Pattern",
  "description": "Links a vulnerable package, configuration, or weakness class to public compliance controls.",
  "type": "object",
  "required": ["pattern_id", "name", "match", "controls", "rationale"],
  "properties": {
    "pattern_id": {
      "type": "string",
      "pattern": "^PP-[0-9]{4}$",
      "description": "Stable identifier, e.g. PP-0001"
    },
    "name": {
      "type": "string",
      "description": "Short human-readable label"
    },
    "description": {
      "type": "string",
      "description": "One or two sentences on what this pattern represents"
    },
    "weakness_class": {
      "type": "string",
      "description": "Optional CWE or OWASP category tag, e.g. CWE-327, A02:2021"
    },
    "match": {
      "type": "object",
      "description": "How PatchPilot decides a finding matches this pattern.",
      "properties": {
        "package": { "type": "string" },
        "ecosystem": {
          "type": "string",
          "enum": ["pypi", "npm", "maven", "rubygems", "go", "cargo", "composer", "os", "generic"]
        },
        "version_below": { "type": "string" },
        "cve_ids": {
          "type": "array",
          "items": { "type": "string", "pattern": "^CVE-[0-9]{4}-[0-9]+$" }
        },
        "cwe_ids": {
          "type": "array",
          "items": { "type": "string", "pattern": "^CWE-[0-9]+$" }
        }
      },
      "additionalProperties": false
    },
    "controls": {
      "type": "object",
      "description": "Public compliance control identifiers this pattern affects.",
      "properties": {
        "nist_800_53_rev5": {
          "type": "array",
          "items": { "type": "string" },
          "description": "NIST SP 800-53 Rev 5 control IDs, e.g. SC-8"
        },
        "cis_controls_v8": {
          "type": "array",
          "items": { "type": "string" },
          "description": "CIS Controls v8 safeguards, e.g. 3.10"
        },
        "pci_dss_4_0": {
          "type": "array",
          "items": { "type": "string" },
          "description": "PCI DSS 4.0 requirement IDs, e.g. 6.3.3"
        },
        "iso_27001_2022": {
          "type": "array",
          "items": { "type": "string" },
          "description": "ISO/IEC 27001:2022 Annex A control IDs, e.g. A.8.24"
        },
        "owasp_asvs_v4": {
          "type": "array",
          "items": { "type": "string" },
          "description": "OWASP ASVS v4 requirement IDs"
        }
      },
      "additionalProperties": false
    },
    "rationale": {
      "type": "string",
      "description": "Why this pattern breaks the listed controls. Must cite what the control requires."
    },
    "remediation_priority": {
      "type": "string",
      "enum": ["critical", "high", "medium", "low"]
    },
    "references": {
      "type": "array",
      "items": { "type": "string", "format": "uri" }
    }
  },
  "additionalProperties": false
}
