{
  "pattern_id": "PP-0009",
  "name": "SQLAlchemy raw-query injection class (CWE-89)",
  "description": "Patterns that match SQL-injection-class weaknesses reported by scanners in ORMs that allow raw query execution without parameter binding.",
  "weakness_class": "CWE-89",
  "match": {
    "cwe_ids": ["CWE-89"],
    "ecosystem": "generic"
  },
  "controls": {
    "nist_800_53_rev5": ["SI-10", "SC-8", "AC-4"],
    "cis_controls_v8": ["16.10", "16.11"],
    "pci_dss_4_0": ["6.2.4", "6.3.1"],
    "iso_27001_2022": ["A.8.25", "A.8.28"],
    "owasp_asvs_v4": ["5.3.4", "5.3.5"]
  },
  "rationale": "SQL injection defeats NIST SI-10 (input validation) and AC-4 (information flow enforcement). PCI DSS 6.2.4 requires secure coding practices addressing injection. OWASP ASVS 5.3.4/5.3.5 require parameterised queries or prepared statements.",
  "remediation_priority": "high",
  "references": [
    "https://cwe.mitre.org/data/definitions/89.html"
  ]
}
